{
  "buggy_revision": "aa55975c7d3f6c9f6d7f68accc41bb7cadf0eb9a",
  "difficulty": "ENGINEERING",
  "editable_paths": [
    "workspace/phase_capture.py"
  ],
  "expected_outcomes": {
    "buggy": "FAIL",
    "reference": "PASS"
  },
  "external_service_required": false,
  "expected_baseline_failure": {
    "expected_exit_class": "NON_ZERO",
    "failed_node_ids": [
      "tests/visible/test_phase_clear.py::test_clear_updates_records_already_bound_to_call_phase"
    ],
    "fingerprint_version": 1,
    "match_mode": "EXACT_SET",
    "runner": "pytest"
  },
  "fixed_revision": "966d4fb3e4640de721f87e4190427975ea020c67",
  "fixture_schema_version": "1.0.0",
  "immutable_file_sha256": {
    "ATTRIBUTION.md": "2eaba099df25bcb19a093333e837848c7114a92789e8316973610ce8b248f151",
    "reference/fixed_files/phase_capture.py": "e646397a711510979af4f4938249b9d240237228e2a627483126f1d7129e7cb9",
    "tests/hidden/test_phase_lifecycle.py": "4ff7ee467daf2ccb001a9ca65b222f19bf92f06c464d2efaec323e90753b4d83",
    "tests/visible/test_phase_clear.py": "519a95e9fe0a9d54ff5d740be81881514eaeeecaacaf2da3ed87001a80563004"
  },
  "license": "MIT",
  "limits": {
    "max_output_chars": 10000,
    "timeout_seconds": 15
  },
  "network_required": false,
  "protected_paths": [
    "ATTRIBUTION.md",
    "reference/fixed_files/phase_capture.py",
    "task_manifest.json",
    "tests/hidden/test_phase_lifecycle.py",
    "tests/visible/test_phase_clear.py"
  ],
  "reference_files": [
    "reference/fixed_files/phase_capture.py"
  ],
  "repair_prompt": {
    "description": "Clearing the capture handler leaves records already associated with the active phase out of sync. Repair phase capture so clearing updates what callers observe for that phase.",
    "schema_version": 1,
    "success_conditions": [
      "Clearing removes records already associated with the active phase.",
      "Subsequent phase logging continues to expose the current records."
    ],
    "title": "Keep phase capture records synchronized after clear"
  },
  "source_kind": "SWE_BENCH",
  "source_urls": [
    "https://github.com/pytest-dev/pytest/issues/9877",
    "https://github.com/pytest-dev/pytest/commit/966d4fb3e4640de721f87e4190427975ea020c67"
  ],
  "task_id": "swebench-pytest-10051",
  "test_commands": {
    "hidden": [
      "-m",
      "pytest",
      "tests/hidden",
      "-q"
    ],
    "visible": [
      "-m",
      "pytest",
      "tests/visible",
      "-q"
    ]
  }
}
