{
  "buggy_revision": null,
  "difficulty": "ENGINEERING",
  "editable_paths": [
    "workspace/parcel_flow/models.py",
    "workspace/parcel_flow/store.py",
    "workspace/parcel_flow/dispatcher.py",
    "workspace/parcel_flow/service.py"
  ],
  "expected_outcomes": {
    "buggy": "FAIL",
    "reference": "PASS"
  },
  "external_service_required": false,
  "expected_baseline_failure": {
    "expected_exit_class": "NON_ZERO",
    "failed_node_ids": [
      "tests/visible/test_restart_dispatch.py::test_restart_after_dispatch_does_not_store_a_second_dispatch"
    ],
    "fingerprint_version": 1,
    "match_mode": "EXACT_SET",
    "runner": "pytest"
  },
  "fixed_revision": null,
  "fixture_schema_version": "1.0.0",
  "immutable_file_sha256": {
    "ATTRIBUTION.md": "ae3cf151111a7d612a1bd58f388b595b84d3dc00be1557f39a595be450a84615",
    "reference/fixed_files/parcel_flow/store.py": "6854dcd49a7aa143ef7764e0d265771c9cfe391a53a8900002b3140bd83bacea",
    "tests/hidden/test_recovery_invariants.py": "5a27060ab5bfb9990a39318e5819e921270d04e616a1610f0f25055c467c08a3",
    "tests/visible/test_restart_dispatch.py": "d6376a34c5d46ad1b94c846270983d1edb7a313086a2103d788750743ecc3824"
  },
  "license": "AgentForge project original",
  "limits": {
    "max_output_chars": 15000,
    "timeout_seconds": 30
  },
  "network_required": false,
  "protected_paths": [
    "ATTRIBUTION.md",
    "reference/fixed_files/parcel_flow/store.py",
    "task_manifest.json",
    "tests/hidden/test_recovery_invariants.py",
    "tests/visible/test_restart_dispatch.py"
  ],
  "reference_files": [
    "reference/fixed_files/parcel_flow/store.py"
  ],
  "repair_prompt": {
    "description": "When the parcel service stops during handoff and then restarts, processing the same command can store a duplicate dispatch. Repair the implementation so recovery returns a consistent result without recording another dispatch.",
    "schema_version": 1,
    "success_conditions": [
      "Restarting after an interrupted handoff does not create a duplicate dispatch.",
      "Repeated processing returns the completed command result."
    ],
    "title": "Prevent duplicate parcel dispatch after restart"
  },
  "source_kind": "SELF_BUILT",
  "source_urls": [],
  "task_id": "self-durable-double-consumption",
  "test_commands": {
    "hidden": [
      "-m",
      "pytest",
      "tests/hidden",
      "-q"
    ],
    "visible": [
      "-m",
      "pytest",
      "tests/visible",
      "-q"
    ]
  }
}
